{
  "$schema": "https://json-schema.org/draft/2020-12/schema",
  "type": "object",
  "properties": {
    "generatedAt": {
      "type": "string",
      "format": "date-time",
      "pattern": "^(?:(?:\\d\\d[2468][048]|\\d\\d[13579][26]|\\d\\d0[48]|[02468][048]00|[13579][26]00)-02-29|\\d{4}-(?:(?:0[13578]|1[02])-(?:0[1-9]|[12]\\d|3[01])|(?:0[469]|11)-(?:0[1-9]|[12]\\d|30)|(?:02)-(?:0[1-9]|1\\d|2[0-8])))T(?:(?:[01]\\d|2[0-3]):[0-5]\\d:[0-5]\\d(?:\\.\\d+)?(?:Z|([+-](?:[01]\\d|2[0-3]):[0-5]\\d)))$"
    },
    "source": {
      "type": "string"
    },
    "sourceUrl": {
      "type": "string"
    },
    "regions": {
      "type": "array",
      "items": {
        "type": "object",
        "properties": {
          "region": {
            "type": "string"
          },
          "regionName": {
            "type": "string"
          },
          "year": {
            "type": "integer",
            "minimum": -9007199254740991,
            "maximum": 9007199254740991
          },
          "mwe": {
            "type": "number"
          },
          "gt": {
            "type": "number"
          }
        },
        "required": [
          "region",
          "regionName",
          "year",
          "mwe"
        ]
      }
    }
  },
  "required": [
    "generatedAt",
    "source",
    "sourceUrl",
    "regions"
  ],
  "$id": "https://ava-sipi.dev/schema/mass-balance.json",
  "title": "mass-balance"
}
